{
  "cache_kind": "derived_weather_events",
  "cache_schema_version": "1.0.0",
  "cache_update": {
    "cache_fills": 0,
    "cache_hits": 0,
    "cache_invalid": 0,
    "dates_added": 1,
    "dates_recomputed": 0,
    "dates_removed": 0,
    "files_written": 1,
    "source_dates_changed": 0
  },
  "cached_dates": [
    "2026-08-25",
    "2026-08-26",
    "2026-08-27",
    "2026-08-28",
    "2026-08-29",
    "2026-08-30",
    "2026-08-31",
    "2026-09-01",
    "2026-09-02",
    "2026-09-03",
    "2026-09-04",
    "2026-09-05",
    "2026-09-06",
    "2026-09-07",
    "2026-09-08",
    "2026-09-09",
    "2026-09-10",
    "2026-09-11",
    "2026-09-12",
    "2026-09-13",
    "2026-09-14",
    "2026-09-15",
    "2026-09-16",
    "2026-09-17",
    "2026-09-18",
    "2026-09-19",
    "2026-09-20",
    "2026-09-21",
    "2026-09-22",
    "2026-09-23",
    "2026-09-24",
    "2026-09-25",
    "2026-09-26",
    "2026-09-27",
    "2026-09-28",
    "2026-09-29",
    "2026-09-30",
    "2026-10-01",
    "2026-10-02",
    "2026-10-03",
    "2026-10-04",
    "2026-10-05",
    "2026-10-06",
    "2026-10-07",
    "2026-10-08",
    "2026-10-09",
    "2026-10-10",
    "2026-10-11",
    "2026-10-12",
    "2026-10-13",
    "2026-10-14",
    "2026-10-15",
    "2026-10-16",
    "2026-10-17",
    "2026-10-18",
    "2026-10-19",
    "2026-10-20"
  ],
  "daily": [
    {
      "complete": true,
      "date": "2026-08-25",
      "dtr_c": 12.1,
      "freeze": false,
      "freeze_and_snow": false,
      "gust_ge_50": false,
      "gust_ge_65": false,
      "hard_freeze_le_minus5": false,
      "mechanical_leaf_stress": {
        "level": "MEDIUM",
        "reasons": [],
        "rule_version": "mechanical_leaf_stress_v1"
      },
      "night_min_c": 9.6,
      "precipitation_mm": 0.6,
      "rain_and_gust_ge_50": false,
      "rain_day": true,
      "snow_and_gust_ge_50": false,
      "snow_day": false,
      "snowfall_cm": 0.0,
      "source_fingerprint": "6ad55dca15deb365d243df1ad11842737ea9e0302f8b0b24fceda02d07e45b3b",
      "source_state": "finalized_history",
      "temperature_max_c": 21.5,
      "temperature_mean_c": 14.746,
      "temperature_min_c": 9.4,
      "wind_gust_max_kmh": 34.6,
      "wind_speed_mean_kmh": 3.333
    },
    {
      "complete": true,
      "date": "2026-08-26",
      "dtr_c": 11.3,
      "freeze": false,
      "freeze_and_snow": false,
      "gust_ge_50": false,
      "gust_ge_65": false,
      "hard_freeze_le_minus5": false,
      "mechanical_leaf_stress": {
        "level": "MEDIUM",
        "reasons": [],
        "rule_version": "mechanical_leaf_stress_v1"
      },
      "night_min_c": 10.1,
      "precipitation_mm": 2.1,
      "rain_and_gust_ge_50": false,
      "rain_day": true,
      "snow_and_gust_ge_50": false,
      "snow_day": false,
      "snowfall_cm": 0.0,
      "source_fingerprint": "bdbef72d7c56e142c9e837179dc4854c804d94a2450959795542ac8349c38338",
      "source_state": "finalized_history",
      "temperature_max_c": 21.0,
      "temperature_mean_c": 14.642,
      "temperature_min_c": 9.7,
      "wind_gust_max_kmh": 32.8,
      "wind_speed_mean_kmh": 3.875
    },
    {
      "complete": true,
      "date": "2026-08-27",
      "dtr_c": 10.9,
      "freeze": false,
      "freeze_and_snow": false,
      "gust_ge_50": false,
      "gust_ge_65": false,
      "hard_freeze_le_minus5": false,
      "mechanical_leaf_stress": {
        "level": "MEDIUM",
        "reasons": [],
        "rule_version": "mechanical_leaf_stress_v1"
      },
      "night_min_c": 10.1,
      "precipitation_mm": 5.3,
      "rain_and_gust_ge_50": false,
      "rain_day": true,
      "snow_and_gust_ge_50": false,
      "snow_day": false,
      "snowfall_cm": 0.0,
      "source_fingerprint": "8f0f22644349ed35fab2d8e99287626226b2e2b4897d3e6b727c13da835431d0",
      "source_state": "finalized_history",
      "temperature_max_c": 21.0,
      "temperature_mean_c": 14.521,
      "temperature_min_c": 10.1,
      "wind_gust_max_kmh": 34.6,
      "wind_speed_mean_kmh": 4.046
    },
    {
      "complete": true,
      "date": "2026-08-28",
      "dtr_c": 10.4,
      "freeze": false,
      "freeze_and_snow": false,
      "gust_ge_50": false,
      "gust_ge_65": false,
      "hard_freeze_le_minus5": false,
      "mechanical_leaf_stress": {
        "level": "MEDIUM",
        "reasons": [],
        "rule_version": "mechanical_leaf_stress_v1"
      },
      "night_min_c": 9.7,
      "precipitation_mm": 4.4,
      "rain_and_gust_ge_50": false,
      "rain_day": true,
      "snow_and_gust_ge_50": false,
      "snow_day": false,
      "snowfall_cm": 0.0,
      "source_fingerprint": "f6ef7b2deb5cdaae35988ede8fe6e6189a7e228bdae158cfb2bf1627167d2b7b",
      "source_state": "finalized_history",
      "temperature_max_c": 19.7,
      "temperature_mean_c": 13.329,
      "temperature_min_c": 9.3,
      "wind_gust_max_kmh": 33.8,
      "wind_speed_mean_kmh": 4.213
    },
    {
      "complete": true,
      "date": "2026-08-29",
      "dtr_c": 4.7,
      "freeze": false,
      "freeze_and_snow": false,
      "gust_ge_50": false,
      "gust_ge_65": false,
      "hard_freeze_le_minus5": false,
      "mechanical_leaf_stress": {
        "level": "MEDIUM",
        "reasons": [],
        "rule_version": "mechanical_leaf_stress_v1"
      },
      "night_min_c": 8.3,
      "precipitation_mm": 7.6,
      "rain_and_gust_ge_50": false,
      "rain_day": true,
      "snow_and_gust_ge_50": false,
      "snow_day": false,
      "snowfall_cm": 0.0,
      "source_fingerprint": "fc6fd2513d3d4b5860dd07f70c8433f6310ec7d94c656bd4eef116aa563007ec",
      "source_state": "finalized_history",
      "temperature_max_c": 13.0,
      "temperature_mean_c": 10.129,
      "temperature_min_c": 8.3,
      "wind_gust_max_kmh": 24.8,
      "wind_speed_mean_kmh": 2.808
    },
    {
      "complete": true,
      "date": "2026-08-30",
      "dtr_c": 10.5,
      "freeze": false,
      "freeze_and_snow": false,
      "gust_ge_50": false,
      "gust_ge_65": false,
      "hard_freeze_le_minus5": false,
      "mechanical_leaf_stress": {
        "level": "MEDIUM",
        "reasons": [],
        "rule_version": "mechanical_leaf_stress_v1"
      },
      "night_min_c": 7.5,
      "precipitation_mm": 2.0,
      "rain_and_gust_ge_50": false,
      "rain_day": true,
      "snow_and_gust_ge_50": false,
      "snow_day": false,
      "snowfall_cm": 0.0,
      "source_fingerprint": "cbd9318ed39b58b755e620a0cb25846c40aed3817cee5d83b3f90b789976be45",
      "source_state": "finalized_history",
      "temperature_max_c": 17.7,
      "temperature_mean_c": 11.267,
      "temperature_min_c": 7.2,
      "wind_gust_max_kmh": 25.2,
      "wind_speed_mean_kmh": 2.492
    },
    {
      "complete": true,
      "date": "2026-08-31",
      "dtr_c": 11.0,
      "freeze": false,
      "freeze_and_snow": false,
      "gust_ge_50": false,
      "gust_ge_65": false,
      "hard_freeze_le_minus5": false,
      "mechanical_leaf_stress": {
        "level": "MEDIUM",
        "reasons": [],
        "rule_version": "mechanical_leaf_stress_v1"
      },
      "night_min_c": 5.8,
      "precipitation_mm": 2.0,
      "rain_and_gust_ge_50": false,
      "rain_day": true,
      "snow_and_gust_ge_50": false,
      "snow_day": false,
      "snowfall_cm": 0.0,
      "source_fingerprint": "8f7a8e9d67948122f4933329970a2d77b980b6e89a425da1edc5622c0d71299c",
      "source_state": "finalized_history",
      "temperature_max_c": 16.5,
      "temperature_mean_c": 10.296,
      "temperature_min_c": 5.5,
      "wind_gust_max_kmh": 28.8,
      "wind_speed_mean_kmh": 2.071
    },
    {
      "complete": true,
      "date": "2026-09-01",
      "dtr_c": 11.6,
      "freeze": false,
      "freeze_and_snow": false,
      "gust_ge_50": false,
      "gust_ge_65": false,
      "hard_freeze_le_minus5": false,
      "mechanical_leaf_stress": {
        "level": "MEDIUM",
        "reasons": [],
        "rule_version": "mechanical_leaf_stress_v1"
      },
      "night_min_c": 5.4,
      "precipitation_mm": 1.3,
      "rain_and_gust_ge_50": false,
      "rain_day": true,
      "snow_and_gust_ge_50": false,
      "snow_day": false,
      "snowfall_cm": 0.0,
      "source_fingerprint": "a1c72e32277e75430f8a5f759d8ecfd8eb408ad02ec46d1646ff44a20b5609f1",
      "source_state": "finalized_history",
      "temperature_max_c": 16.7,
      "temperature_mean_c": 9.883,
      "temperature_min_c": 5.1,
      "wind_gust_max_kmh": 32.0,
      "wind_speed_mean_kmh": 2.508
    },
    {
      "complete": true,
      "date": "2026-09-02",
      "dtr_c": 14.9,
      "freeze": false,
      "freeze_and_snow": false,
      "gust_ge_50": false,
      "gust_ge_65": false,
      "hard_freeze_le_minus5": false,
      "mechanical_leaf_stress": {
        "level": "MEDIUM",
        "reasons": [],
        "rule_version": "mechanical_leaf_stress_v1"
      },
      "night_min_c": 3.3,
      "precipitation_mm": 1.6,
      "rain_and_gust_ge_50": false,
      "rain_day": true,
      "snow_and_gust_ge_50": false,
      "snow_day": false,
      "snowfall_cm": 0.0,
      "source_fingerprint": "ada55167d88a6ce39947d81d615ee661831f10887a05d8dbb0f4671caae97c96",
      "source_state": "finalized_history",
      "temperature_max_c": 17.3,
      "temperature_mean_c": 9.692,
      "temperature_min_c": 2.4,
      "wind_gust_max_kmh": 33.1,
      "wind_speed_mean_kmh": 2.846
    },
    {
      "complete": true,
      "date": "2026-09-03",
      "dtr_c": 13.1,
      "freeze": false,
      "freeze_and_snow": false,
      "gust_ge_50": false,
      "gust_ge_65": false,
      "hard_freeze_le_minus5": false,
      "mechanical_leaf_stress": {
        "level": "LOW",
        "reasons": [],
        "rule_version": "mechanical_leaf_stress_v1"
      },
      "night_min_c": 5.6,
      "precipitation_mm": 0.0,
      "rain_and_gust_ge_50": false,
      "rain_day": false,
      "snow_and_gust_ge_50": false,
      "snow_day": false,
      "snowfall_cm": 0.0,